{
  "$schema": "./launch-coverage.v1.schema.json",
  "manifestVersion": "1.0.0",
  "reviewedAt": "2026-09-09",
  "launchDecision": "candidate_only",
  "publicClaim": "All seven named chains are represented across Oslo, Bergen, and Trondheim as candidate-only coverage cells. No region is selected: current national observations lack municipality scope proof and Handleplan-specific source agreements remain unresolved.",
  "requiredChains": [
    {
      "id": "bunnpris",
      "displayName": "Bunnpris"
    },
    {
      "id": "rema-1000",
      "displayName": "REMA 1000"
    },
    {
      "id": "extra",
      "displayName": "Extra"
    },
    {
      "id": "meny",
      "displayName": "MENY"
    },
    {
      "id": "spar",
      "displayName": "SPAR"
    },
    {
      "id": "joker",
      "displayName": "Joker"
    },
    {
      "id": "europris",
      "displayName": "Europris"
    }
  ],
  "candidateRegions": [
    {
      "id": "no-0301-oslo",
      "name": "Oslo",
      "municipalityCode": "0301",
      "boundaryType": "municipality",
      "selectionStatus": "candidate_unverified",
      "selected": false,
      "chainPresenceEvidence": [
        {
          "chainId": "bunnpris",
          "url": "https://www.bunnpris.no/butikker/bunnpris-sinsen",
          "accessedAt": "2026-07-16",
          "finding": "Official page lists Bunnpris Sinsen in Oslo. Presence does not prove price or offer coverage."
        },
        {
          "chainId": "rema-1000",
          "url": "https://www.rema.no/butikker/oslo/oslo/rema-1000-storgata/",
          "accessedAt": "2026-07-16",
          "finding": "Official page lists REMA 1000 Storgata in Oslo. Presence does not prove price or offer coverage."
        },
        {
          "chainId": "extra",
          "url": "https://www.coop.no/butikker/extra/extra-st-halvardsgate-4276",
          "accessedAt": "2026-07-16",
          "finding": "Official page lists Extra St. Halvardsgate in Oslo. Presence does not prove price or offer coverage."
        }
      ],
      "offerScopeEvidence": [
        {
          "chainId": "rema-1000",
          "url": "https://www.rema.no/kundeaviser/oslo/",
          "accessedAt": "2026-07-16",
          "finding": "Official page says the publication applies in Oslo and Gjelleråsen. Automated reuse permission remains unresolved."
        }
      ],
      "knownGaps": [
        "No municipality-scoped product-level ordinary-price coverage for all seven chains",
        "No rights-cleared official-offer source for any chain",
        "Runtime source approvals are not Handleplan-specific agreement evidence",
        "National or unknown-scope rows are preserved separately and cannot support regional claims",
        "No freshness, known-not-carried, or branch-directory completeness proof by municipality"
      ]
    },
    {
      "id": "no-4601-bergen",
      "name": "Bergen",
      "municipalityCode": "4601",
      "boundaryType": "municipality",
      "selectionStatus": "candidate_unverified",
      "selected": false,
      "chainPresenceEvidence": [
        {
          "chainId": "bunnpris",
          "url": "https://www.bunnpris.no/butikker/bunnpris-nygardsgaten",
          "accessedAt": "2026-07-16",
          "finding": "Official page lists Bunnpris Nygårdsgaten in Bergen. Presence does not prove price or offer coverage."
        },
        {
          "chainId": "rema-1000",
          "url": "https://www.rema.no/butikker/vestland/bergen/rema-1000-haukelandsveien/",
          "accessedAt": "2026-07-16",
          "finding": "Official page lists REMA 1000 Haukelandsveien in Bergen. Presence does not prove price or offer coverage."
        },
        {
          "chainId": "extra",
          "url": "https://www.coop.no/butikker/extra/extra-bergen-storsenter-4219",
          "accessedAt": "2026-07-16",
          "finding": "Official page lists Extra Bergen Storsenter in Bergen. Presence does not prove price or offer coverage."
        }
      ],
      "offerScopeEvidence": [
        {
          "chainId": "rema-1000",
          "url": "https://www.rema.no/kundeaviser/vest/",
          "accessedAt": "2026-07-16",
          "finding": "Official page says the Vest publication applies in old Hordaland except Etne. Automated reuse permission remains unresolved."
        },
        {
          "chainId": "extra",
          "url": "https://kundeavis.coop.no/aviser/extra/hordaland/",
          "accessedAt": "2026-07-16",
          "finding": "Official publication is labelled Hordaland. Store-to-publication mapping and automated reuse permission remain unresolved."
        }
      ],
      "knownGaps": [
        "No municipality-scoped product-level ordinary-price coverage for all seven chains",
        "No rights-cleared official-offer source for any chain",
        "Runtime source approvals are not Handleplan-specific agreement evidence",
        "National or unknown-scope rows are preserved separately and cannot support regional claims",
        "No freshness, known-not-carried, or branch-directory completeness proof by municipality"
      ]
    },
    {
      "id": "no-5001-trondheim",
      "name": "Trondheim",
      "municipalityCode": "5001",
      "boundaryType": "municipality",
      "selectionStatus": "candidate_unverified",
      "selected": false,
      "chainPresenceEvidence": [
        {
          "chainId": "bunnpris",
          "url": "https://www.bunnpris.no/butikker/bunnpris-munkegaten",
          "accessedAt": "2026-07-16",
          "finding": "Official page lists Bunnpris Munkegaten in Trondheim. Presence does not prove price or offer coverage."
        },
        {
          "chainId": "rema-1000",
          "url": "https://www.rema.no/butikker/trondelag/trondheim/rema-1000-torvet/",
          "accessedAt": "2026-07-16",
          "finding": "Official page lists REMA 1000 Torvet in Trondheim. Presence does not prove price or offer coverage."
        },
        {
          "chainId": "extra",
          "url": "https://www.coop.no/butikker/extra/extra-tempe-4361",
          "accessedAt": "2026-07-16",
          "finding": "Official page lists Extra Tempe in Trondheim. Presence does not prove price or offer coverage."
        }
      ],
      "offerScopeEvidence": [
        {
          "chainId": "rema-1000",
          "url": "https://www.rema.no/kundeaviser/midtnorge/",
          "accessedAt": "2026-07-16",
          "finding": "Official page says the Midt-Norge publication applies in Trøndelag and at Tynset. Automated reuse permission remains unresolved."
        },
        {
          "chainId": "extra",
          "url": "https://kundeavis.coop.no/aviser/extra/midt/",
          "accessedAt": "2026-07-16",
          "finding": "Official publication is labelled Midt. Store-to-publication mapping and automated reuse permission remain unresolved."
        }
      ],
      "knownGaps": [
        "No municipality-scoped product-level ordinary-price coverage for all seven chains",
        "No rights-cleared official-offer source for any chain",
        "Runtime source approvals are not Handleplan-specific agreement evidence",
        "National or unknown-scope rows are preserved separately and cannot support regional claims",
        "No freshness, known-not-carried, or branch-directory completeness proof by municipality"
      ]
    }
  ],
  "coverage": [
    {
      "regionId": "no-0301-oslo",
      "chainId": "bunnpris",
      "priceClass": "ordinary",
      "activeSourceId": null,
      "candidateSourceIds": [
        "kassalapp",
        "open-prices"
      ],
      "coverageStatus": "unknown",
      "evidenceLevel": "measured",
      "geographicScope": "National/unknown-scope observations only; municipality applicability is unproven.",
      "refreshTargetHours": 72,
      "knownGaps": [
        "Handleplan-specific source agreement/reference is unresolved",
        "Regional applicability is unproven; only national or unknown-scope observations exist",
        "No municipality/store scope proof",
        "Freshness and completeness are measured nationally only"
      ],
      "launchEligible": false
    },
    {
      "regionId": "no-0301-oslo",
      "chainId": "bunnpris",
      "priceClass": "official_offer",
      "activeSourceId": null,
      "candidateSourceIds": [
        "tjek"
      ],
      "coverageStatus": "unknown",
      "evidenceLevel": "technical_sample",
      "geographicScope": "No rights-cleared municipality-scoped official-offer evidence.",
      "refreshTargetHours": 48,
      "knownGaps": [
        "Handleplan-specific source agreement/reference is unresolved",
        "Regional applicability is unproven; only national or unknown-scope observations exist",
        "No municipality/store scope proof",
        "No rights-cleared current official-offer projection for this chain/region"
      ],
      "launchEligible": false
    },
    {
      "regionId": "no-0301-oslo",
      "chainId": "rema-1000",
      "priceClass": "ordinary",
      "activeSourceId": null,
      "candidateSourceIds": [
        "kassalapp",
        "open-prices"
      ],
      "coverageStatus": "unknown",
      "evidenceLevel": "measured",
      "geographicScope": "National/unknown-scope observations only; municipality applicability is unproven.",
      "refreshTargetHours": 72,
      "knownGaps": [
        "Handleplan-specific source agreement/reference is unresolved",
        "Regional applicability is unproven; only national or unknown-scope observations exist",
        "No municipality/store scope proof",
        "Freshness and completeness are measured nationally only"
      ],
      "launchEligible": false
    },
    {
      "regionId": "no-0301-oslo",
      "chainId": "rema-1000",
      "priceClass": "official_offer",
      "activeSourceId": null,
      "candidateSourceIds": [
        "tjek"
      ],
      "coverageStatus": "unknown",
      "evidenceLevel": "none",